{
  "format": "job-kit-ui/1",
  "label": "synthetic/illustrative seed — not licensed data; tradesperson review required",
  "status": "needs_tradesperson_review",
  "library_version": "0.2.0",
  "market": "uk",
  "assumption_source": "default_template",
  "scope": {
    "scope_id": "bathroom_full",
    "id": "uk.bathroom.full",
    "job_type": "bathroom",
    "scope": "full",
    "title": "Full bathroom refit (bath, basin, WC, shower)",
    "description": "Strip out and refit a family bathroom: bath with panel, basin, WC, shower over the bath or in an enclosure, tiling, extract, electrics and decorating. Skeleton from the Decent Homes bathroom items and two social-landlord specifications.",
    "version": "0.2.0"
  },
  "max_upfront_questions": 3,
  "upfront_questions": [
    "layout_change",
    "wc_type",
    "shower_type"
  ],
  "questions": [
    {
      "id": "layout_change",
      "question": "Is the layout changing (new stud partition, moved fittings)?",
      "type": "bool",
      "ask": "upfront",
      "priority": 9,
      "default": false,
      "options": [
        {
          "value": false,
          "label": "No, same layout"
        },
        {
          "value": true,
          "label": "Yes, new partition or moved fittings"
        }
      ]
    },
    {
      "id": "wc_type",
      "question": "WC type?",
      "type": "enum",
      "ask": "upfront",
      "priority": 11,
      "default": "close_coupled",
      "options": [
        {
          "value": "close_coupled",
          "label": "Close-coupled (cistern on the pan)"
        },
        {
          "value": "wall_hung",
          "label": "Wall-hung pan on a concealed frame"
        }
      ]
    },
    {
      "id": "shower_type",
      "question": "Shower type?",
      "type": "enum",
      "ask": "upfront",
      "priority": 9,
      "default": "electric",
      "options": [
        {
          "value": "electric",
          "label": "Electric shower"
        },
        {
          "value": "mixer",
          "label": "Mixer shower (hot and cold feeds)"
        }
      ]
    },
    {
      "id": "shower_kw",
      "question": "Electric shower rating in kW (selects the circuit lookup row; ignored for a mixer shower)?",
      "type": "enum",
      "ask": "on_review",
      "priority": 2,
      "default": "8.5",
      "options": [
        {
          "value": "7.0",
          "label": "7.0 kW"
        },
        {
          "value": "7.5",
          "label": "7.5 kW"
        },
        {
          "value": "8.0",
          "label": "8.0 kW"
        },
        {
          "value": "8.5",
          "label": "8.5 kW"
        },
        {
          "value": "9.0",
          "label": "9.0 kW"
        },
        {
          "value": "9.5",
          "label": "9.5 kW"
        },
        {
          "value": "10.5",
          "label": "10.5 kW"
        }
      ]
    },
    {
      "id": "shower_location",
      "question": "Where is the shower?",
      "type": "enum",
      "ask": "on_review",
      "priority": 5,
      "default": "over_bath",
      "options": [
        {
          "value": "over_bath",
          "label": "Over the bath"
        },
        {
          "value": "enclosure",
          "label": "Separate enclosure with a tray"
        }
      ]
    },
    {
      "id": "basin_mount",
      "question": "Basin type?",
      "type": "enum",
      "ask": "on_review",
      "priority": 3,
      "default": "pedestal",
      "options": [
        {
          "value": "pedestal",
          "label": "Basin on a pedestal"
        },
        {
          "value": "wall_hung",
          "label": "Wall-hung basin"
        }
      ]
    },
    {
      "id": "wall_type",
      "question": "Main wall construction where fittings are fixed?",
      "type": "enum",
      "ask": "on_review",
      "priority": 3,
      "default": "solid",
      "options": [
        {
          "value": "solid",
          "label": "Solid (brick or block)"
        },
        {
          "value": "stud",
          "label": "Stud (timber or metal frame)"
        }
      ]
    },
    {
      "id": "joint_system",
      "question": "Pipe joint system for new pipework?",
      "type": "enum",
      "ask": "on_review",
      "priority": 4,
      "default": "compression",
      "options": [
        {
          "value": "compression",
          "label": "Compression"
        },
        {
          "value": "push_fit",
          "label": "Push-fit"
        },
        {
          "value": "solder",
          "label": "Solder-ring"
        }
      ]
    },
    {
      "id": "floor_finish",
      "question": "Floor finish?",
      "type": "enum",
      "ask": "on_review",
      "priority": 5,
      "default": "sheet_vinyl",
      "options": [
        {
          "value": "sheet_vinyl",
          "label": "Slip-resistant sheet vinyl"
        },
        {
          "value": "tiled",
          "label": "Floor tiles"
        }
      ]
    }
  ],
  "fixed_answers": {},
  "review_defaults": [
    {
      "kind": "question",
      "key": "shower_kw",
      "label": "Electric shower rating in kW (selects the circuit lookup row; ignored for a mixer shower)?",
      "default": "8.5",
      "default_label": "8.5 kW",
      "unit": null
    },
    {
      "kind": "question",
      "key": "shower_location",
      "label": "Where is the shower?",
      "default": "over_bath",
      "default_label": "Over the bath",
      "unit": null
    },
    {
      "kind": "question",
      "key": "basin_mount",
      "label": "Basin type?",
      "default": "pedestal",
      "default_label": "Basin on a pedestal",
      "unit": null
    },
    {
      "kind": "question",
      "key": "wall_type",
      "label": "Main wall construction where fittings are fixed?",
      "default": "solid",
      "default_label": "Solid (brick or block)",
      "unit": null
    },
    {
      "kind": "question",
      "key": "joint_system",
      "label": "Pipe joint system for new pipework?",
      "default": "compression",
      "default_label": "Compression",
      "unit": null
    },
    {
      "kind": "question",
      "key": "floor_finish",
      "label": "Floor finish?",
      "default": "sheet_vinyl",
      "default_label": "Slip-resistant sheet vinyl",
      "unit": null
    },
    {
      "kind": "option",
      "key": "ff_pipe_15",
      "label": "Hot and cold supply pipe",
      "default": "copper",
      "default_label": "Copper",
      "unit": null
    },
    {
      "kind": "option",
      "key": "tl_trim",
      "label": "Tile trim for exposed edges",
      "default": "plastic",
      "default_label": "Plastic trim",
      "unit": null
    },
    {
      "kind": "option",
      "key": "sw_bath_taps",
      "label": "Bath taps or bath mixer",
      "default": "pillar_pair",
      "default_label": "Pair of pillar taps",
      "unit": null
    },
    {
      "kind": "option",
      "key": "sw_basin_taps",
      "label": "Basin taps or basin mixer",
      "default": "pillar_pair",
      "default_label": "Pair of pillar taps",
      "unit": null
    },
    {
      "kind": "option",
      "key": "sw_basin_trap",
      "label": "Basin trap",
      "default": "bottle",
      "default_label": "Bottle trap",
      "unit": null
    },
    {
      "kind": "option",
      "key": "sh_bath_screen_or_curtain",
      "label": "Bath screen or shower curtain and rail",
      "default": "screen",
      "default_label": "Glass bath screen",
      "unit": null
    },
    {
      "kind": "allowance",
      "key": "tanked_m2",
      "label": "Area to tank",
      "default": "4",
      "default_label": "4 m2",
      "unit": "m2"
    },
    {
      "kind": "allowance",
      "key": "backer_board_m2",
      "label": "Backer board area",
      "default": "6",
      "default_label": "6 m2",
      "unit": "m2"
    },
    {
      "kind": "allowance",
      "key": "sealant_joint_m",
      "label": "Sealant joint length",
      "default": "9",
      "default_label": "9 m",
      "unit": "m"
    },
    {
      "kind": "allowance",
      "key": "pipe_15mm_m",
      "label": "15 mm supply pipe run",
      "default": "12",
      "default_label": "12 m",
      "unit": "m"
    },
    {
      "kind": "allowance",
      "key": "waste_32mm_m",
      "label": "32 mm waste run",
      "default": "2",
      "default_label": "2 m",
      "unit": "m"
    },
    {
      "kind": "allowance",
      "key": "waste_40mm_m",
      "label": "40 mm waste run",
      "default": "3",
      "default_label": "3 m",
      "unit": "m"
    },
    {
      "kind": "allowance",
      "key": "shower_cable_run_m",
      "label": "Shower cable run",
      "default": "12",
      "default_label": "12 m",
      "unit": "m"
    },
    {
      "kind": "allowance",
      "key": "fan_cable_run_m",
      "label": "Fan cable run",
      "default": "6",
      "default_label": "6 m",
      "unit": "m"
    },
    {
      "kind": "allowance",
      "key": "fan_duct_run_m",
      "label": "Fan duct run",
      "default": "3",
      "default_label": "3 m",
      "unit": "m"
    },
    {
      "kind": "allowance",
      "key": "partition_length_m",
      "label": "Partition length",
      "default": "1.8",
      "default_label": "1.8 m",
      "unit": "m"
    },
    {
      "kind": "allowance",
      "key": "partition_faces",
      "label": "Partition faces to board",
      "default": "2",
      "default_label": "2 nr",
      "unit": "nr"
    },
    {
      "kind": "allowance",
      "key": "tile_length_cm",
      "label": "Tile length",
      "default": "30",
      "default_label": "30 cm",
      "unit": "cm"
    },
    {
      "kind": "allowance",
      "key": "tile_width_cm",
      "label": "Tile width",
      "default": "60",
      "default_label": "60 cm",
      "unit": "cm"
    },
    {
      "kind": "allowance",
      "key": "tile_thickness_mm",
      "label": "Tile thickness",
      "default": "9",
      "default_label": "9 mm",
      "unit": "mm"
    },
    {